{
  "$schema": "https://json-schema.org/draft/2020-12/schema",
  "$id": "https://schemas.impresari-context.invalid/v1/macos-local-vm-synthetic-guest-payload-receipt.schema.json",
  "title": "ADR-0111 macOS synthetic guest payload receipt",
  "type": "object",
  "additionalProperties": false,
  "required": ["schema_name", "schema_version", "profile_id", "profile_digest", "contract_id", "contract_digest", "status", "payload_member_count", "payload_members_exact", "excluded_component_count", "excluded_components_exact", "controller_binding_exact", "authenticated_future_input_frozen", "build_recipe_frozen", "source_free_validation", "network_access", "credential_access", "process_launch", "guest_payload_materialized", "runnable_guest_artifacts_retained", "release_candidate_complete", "release_bundle_assembled", "developer_id_signature_verified", "apple_notarization_verified", "cask_created", "bundle_installed", "vm_launch", "analyzer_execution", "production_admitted", "macos_iar_1b_admitted", "authority_added"],
  "properties": {
    "schema_name": {"const": "macos-local-vm-synthetic-guest-payload-receipt"},
    "schema_version": {"const": "1.0.0"},
    "profile_id": {"const": "iar-macos-local-vm-synthetic-guest-payload-v1"},
    "profile_digest": {"const": "sha256:3cbcd2a65c268477ab0d01207f0a97da3bbc5543c6415c67140ff9f19b6b10cc"},
    "contract_id": {"const": "iar-macos-local-vm-synthetic-guest-payload-2026-09-01.1"},
    "contract_digest": {"const": "sha256:4e43e28f325d7ab67ff2bb23595eb9273320ff5e8597553b9a681bfdc51033d4"},
    "status": {"const": "source_free_guest_payload_contract_exact"},
    "payload_member_count": {"const": "2"},
    "payload_members_exact": {"const": true},
    "excluded_component_count": {"const": "4"},
    "excluded_components_exact": {"const": true},
    "controller_binding_exact": {"const": true},
    "authenticated_future_input_frozen": {"const": true},
    "build_recipe_frozen": {"const": true},
    "source_free_validation": {"const": true},
    "network_access": {"const": false},
    "credential_access": {"const": false},
    "process_launch": {"const": false},
    "guest_payload_materialized": {"const": false},
    "runnable_guest_artifacts_retained": {"const": false},
    "release_candidate_complete": {"const": false},
    "release_bundle_assembled": {"const": false},
    "developer_id_signature_verified": {"const": false},
    "apple_notarization_verified": {"const": false},
    "cask_created": {"const": false},
    "bundle_installed": {"const": false},
    "vm_launch": {"const": false},
    "analyzer_execution": {"const": false},
    "production_admitted": {"const": false},
    "macos_iar_1b_admitted": {"const": false},
    "authority_added": {"const": false}
  }
}
