{
  "schema_name": "macos-local-vm-synthetic-guest-payload-receipt",
  "schema_version": "1.0.0",
  "profile_id": "iar-macos-local-vm-synthetic-guest-payload-v1",
  "profile_digest": "sha256:3cbcd2a65c268477ab0d01207f0a97da3bbc5543c6415c67140ff9f19b6b10cc",
  "contract_id": "iar-macos-local-vm-synthetic-guest-payload-2026-09-01.1",
  "contract_digest": "sha256:4e43e28f325d7ab67ff2bb23595eb9273320ff5e8597553b9a681bfdc51033d4",
  "status": "source_free_guest_payload_contract_exact",
  "payload_member_count": "2",
  "payload_members_exact": true,
  "excluded_component_count": "4",
  "excluded_components_exact": true,
  "controller_binding_exact": true,
  "authenticated_future_input_frozen": true,
  "build_recipe_frozen": true,
  "source_free_validation": true,
  "network_access": false,
  "credential_access": false,
  "process_launch": false,
  "guest_payload_materialized": false,
  "runnable_guest_artifacts_retained": false,
  "release_candidate_complete": false,
  "release_bundle_assembled": false,
  "developer_id_signature_verified": false,
  "apple_notarization_verified": false,
  "cask_created": false,
  "bundle_installed": false,
  "vm_launch": false,
  "analyzer_execution": false,
  "production_admitted": false,
  "macos_iar_1b_admitted": false,
  "authority_added": false
}
